2025-11-02 14:54:12,591 [INFO] Pipeline initialized (dry_run=False, force=True)
2025-11-02 14:54:12,591 [INFO] ============================================================
2025-11-02 14:54:12,592 [INFO] GROK: SUMMARIZE - DML PIPELINE EXECUTION
2025-11-02 14:54:12,593 [INFO] ============================================================
2025-11-02 14:54:12,594 [INFO] ============================================================
2025-11-02 14:54:12,594 [INFO] GROK: SUMMARIZE - DML PIPELINE EXECUTION
2025-11-02 14:54:12,594 [INFO] ============================================================
2025-11-02 14:54:12,620 [INFO] Discovered 39 files in 28 manifest-approved dirs
2025-11-02 14:54:12,629 [INFO]   -> Success: manifest.yml (6470 -> 3338 bytes, -3.1KB)
2025-11-02 14:54:12,630 [INFO]   -> Success: DIRECTORY_MANIFEST.md (2652 -> 1944 bytes, -0.7KB)
2025-11-02 14:54:12,631 [INFO]   -> Success: SETUP_WINDOWS.md (597 -> 707 bytes, --0.1KB)
2025-11-02 14:54:12,632 [INFO]   -> Success: DIRECTORY_MANIFEST.md (2280 -> 1692 bytes, -0.6KB)
2025-11-02 14:54:12,633 [INFO]   -> Success: Gitlab_install_instructions.txt (47 -> 354 bytes, --0.3KB)
2025-11-02 14:54:12,634 [INFO]   -> Success: DIRECTORY_MANIFEST.md (2220 -> 1608 bytes, -0.6KB)
2025-11-02 14:54:12,634 [INFO]   -> Success: DIRECTORY_MANIFEST.md (2128 -> 1564 bytes, -0.6KB)
2025-11-02 14:54:12,635 [INFO]   -> Success: DIRECTORY_MANIFEST.md (2127 -> 1612 bytes, -0.5KB)
2025-11-02 14:54:12,636 [INFO]   -> Success: DIRECTORY_MANIFEST.md (447 -> 664 bytes, --0.2KB)
2025-11-02 14:54:12,637 [INFO]   -> Success: Airflow_install_instructions.txt (115 -> 399 bytes, --0.3KB)
2025-11-02 14:54:12,637 [INFO]   -> Success: Prefect_install_instructions.txt (46 -> 363 bytes, --0.3KB)
2025-11-02 14:54:12,638 [INFO]   -> Success: DIRECTORY_MANIFEST.md (467 -> 668 bytes, --0.2KB)
2025-11-02 14:54:12,639 [INFO]   -> Success: DIRECTORY_MANIFEST.md (429 -> 656 bytes, --0.2KB)
2025-11-02 14:54:12,640 [INFO]   -> Success: DIRECTORY_MANIFEST.md (451 -> 668 bytes, --0.2KB)
2025-11-02 14:54:12,640 [INFO]   -> Success: DIRECTORY_MANIFEST.md (445 -> 664 bytes, --0.2KB)
2025-11-02 14:54:12,641 [INFO]   -> Success: DIRECTORY_MANIFEST.md (455 -> 660 bytes, --0.2KB)
2025-11-02 14:54:12,642 [INFO]   -> Success: DIRECTORY_MANIFEST.md (447 -> 660 bytes, --0.2KB)
2025-11-02 14:54:12,642 [INFO]   -> Success: DIRECTORY_MANIFEST.md (439 -> 660 bytes, --0.2KB)
2025-11-02 14:54:12,644 [INFO]   -> Success: DIRECTORY_MANIFEST.md (439 -> 660 bytes, --0.2KB)
2025-11-02 14:54:12,645 [INFO]   -> Success: DIRECTORY_MANIFEST.md (437 -> 652 bytes, --0.2KB)
2025-11-02 14:54:12,645 [INFO]   -> Success: DIRECTORY_MANIFEST.md (449 -> 660 bytes, --0.2KB)
2025-11-02 14:54:12,646 [INFO]   -> Success: node__docker_instructions.txt (459 -> 632 bytes, --0.2KB)
2025-11-02 14:54:12,647 [INFO]   -> Success: DIRECTORY_MANIFEST.md (453 -> 656 bytes, --0.2KB)
2025-11-02 14:54:12,648 [INFO]   -> Success: DIRECTORY_MANIFEST.md (447 -> 664 bytes, --0.2KB)
2025-11-02 14:54:12,648 [INFO]   -> Success: OhShINT.txt (97 -> 378 bytes, --0.3KB)
2025-11-02 14:54:12,649 [INFO]   -> Success: DIRECTORY_MANIFEST.md (453 -> 664 bytes, --0.2KB)
2025-11-02 14:54:12,650 [INFO]   -> Success: DIRECTORY_MANIFEST.md (439 -> 660 bytes, --0.2KB)
2025-11-02 14:54:12,650 [INFO]   -> Success: DIRECTORY_MANIFEST.md (461 -> 672 bytes, --0.2KB)
2025-11-02 14:54:12,651 [INFO]   -> Success: DIRECTORY_MANIFEST.md (443 -> 644 bytes, --0.2KB)
2025-11-02 14:54:12,652 [INFO]   -> Success: DIRECTORY_MANIFEST.md (439 -> 648 bytes, --0.2KB)
2025-11-02 14:54:12,652 [INFO]   -> Success: auto_download_manifest.json (489 -> 450 bytes, -0.0KB)
2025-11-02 14:54:12,656 [INFO]   -> Success: config.yaml (1640 -> 666 bytes, -1.0KB)
2025-11-02 14:54:12,657 [INFO]   -> Success: grok_config_yaml.txt (4528 -> 2467 bytes, -2.0KB)
2025-11-02 14:54:12,658 [INFO]   -> Success: requirements.txt (11 -> 307 bytes, --0.3KB)
2025-11-02 14:54:12,658 [INFO]   -> Success: DIRECTORY_MANIFEST.md (441 -> 636 bytes, --0.2KB)
2025-11-02 14:54:12,660 [INFO]   -> Success: TEMPLATE_DIRECTORY_MANIFEST.md (1332 -> 1233 bytes, -0.1KB)
2025-11-02 14:54:12,661 [INFO]   -> Success: project_summary.md (16089 -> 7969 bytes, -7.9KB)
2025-11-02 14:54:12,663 [INFO]   -> Success: filelist_post_mirroring.txt (47498 -> 9074 bytes, -37.5KB)
2025-11-02 14:54:12,664 [INFO]   -> Success: DIRECTORY_MANIFEST.md (429 -> 640 bytes, --0.2KB)
2025-11-02 14:54:12,664 [INFO] ============================================================
2025-11-02 14:54:12,665 [INFO] EXECUTION SUMMARY
2025-11-02 14:54:12,665 [INFO] ============================================================
2025-11-02 14:54:12,665 [INFO] Processed:   39
2025-11-02 14:54:12,666 [INFO] Skipped:     0
2025-11-02 14:54:12,666 [INFO] Failed:      0
2025-11-02 14:54:12,666 [INFO] Space saved: 0.05 MB
2025-11-02 14:54:12,667 [INFO] ============================================================
2025-11-02 14:54:12,667 [ERROR] Fatal error: 'GrokPipeline' object has no attribute 'generate_stats_report'
